<?xml version="1.0" encoding="ISO-8859-1" ?>
<!--
  Copyright (c) 1999 - 2010, Vodafone Group Services Ltd
  All rights reserved.
  
  Redistribution and use in source and binary forms, with or without modification, are permitted provided that the following conditions are met:
  
      * Redistributions of source code must retain the above copyright notice, this list of conditions and the following disclaimer.
      * Redistributions in binary form must reproduce the above copyright notice, this list of conditions and the following disclaimer in the documentation and/or other materials provided with the distribution.
      * Neither the name of the Vodafone Group Services Ltd nor the names of its contributors may be used to endorse or promote products derived from this software without specific prior written permission.
  
  THIS SOFTWARE IS PROVIDED BY THE COPYRIGHT HOLDERS AND CONTRIBUTORS "AS IS" AND ANY EXPRESS OR IMPLIED WARRANTIES, INCLUDING, BUT NOT LIMITED TO, THE IMPLIED WARRANTIES OF MERCHANTABILITY AND FITNESS FOR A PARTICULAR PURPOSE ARE DISCLAIMED. IN NO EVENT SHALL THE COPYRIGHT HOLDER OR CONTRIBUTORS BE LIABLE FOR ANY DIRECT, INDIRECT, INCIDENTAL, SPECIAL, EXEMPLARY, OR CONSEQUENTIAL DAMAGES (INCLUDING, BUT NOT LIMITED TO, PROCUREMENT OF SUBSTITUTE GOODS OR SERVICES; LOSS OF USE, DATA, OR PROFITS; OR BUSINESS INTERRUPTION) HOWEVER CAUSED AND ON ANY THEORY OF LIABILITY, WHETHER IN CONTRACT, STRICT LIABILITY, OR TORT (INCLUDING NEGLIGENCE OR OTHERWISE) ARISING IN ANY WAY OUT OF THE USE OF THIS SOFTWARE, EVEN IF ADVISED OF THE POSSIBILITY OF SUCH DAMAGE.
-->
<!DOCTYPE map_generation-mc2 SYSTEM "map_generation-mc2.dtd">

<map_generation-mc2>

   <map_supplier_name map_supplier="TeleAtlas" >
      <name language="english">Tele Atlas</name>
   </map_supplier_name>

   <map_supplier_name map_supplier="CEInfoSystems">
      <name language="english">MapmyIndia</name>
   </map_supplier_name>

   <map_supplier_name map_supplier="AND">
      <name language="english">AND</name>
      <name language="german">AND</name>
   </map_supplier_name>

   <map_supplier_name map_supplier="Monolit">
      <name language="english">Monolit</name>
   </map_supplier_name>

   <map_supplier_name map_supplier="TopMap">
      <name language="english">TopMap</name>
   </map_supplier_name>

   <map_supplier_name map_supplier="DMapas">
      <name language="english">dmapas</name>
   </map_supplier_name>
            
   <map_supplier_name map_supplier="NavTech">
      <name language="english">NAVTEQ</name>
   </map_supplier_name>
            
   <map_supplier_name map_supplier="Carmenta">
      <name language="english">Carmenta</name>
   </map_supplier_name>
            
   <map_supplier_name map_supplier="OpenStreetMap">
      <name language="english">OpenStreetMap</name>
   </map_supplier_name>
            

</map_generation-mc2>
